Original	Article	Author	PostAuthor	No	Month	Year
	Exploring the ‘Community’ in Baptist ‘Community’ Churches	Dr Anne Klose		87	4	2014
	Historic Meeting of Archivists			86	12	2013
	The Australian Baptist: becoming available in digital form			86	12	2013
	From Five Barley Loaves: now published			86	12	2013
	Baptists in the Golden West: Rockville Baptist Church	David Parker		86	12	2013
	Baptists in the Golden West: Baptists Dream of the South West! Part 1	David Parker		86	12	2013
	BHQ - 29th Annual Report			86	12	2013
	Heritage Developments			85	8	2013
	The Wharf Street Dispute of 1864	Bill Hughes		85	8	2013
	Tracing our First Minister: More Stewart Family Details			85	8	2013
	Baptists in the Golden West			85	8	2013
	BHQ Baptist Essay Prize 2012 Winners			84	4	2013
	Prize Essay: Tim Lucas (abbreviated)	Tim Lucas		84	4	2013
	Prize Essay: Matt Littlefield (abbreviated)	Matt Littlefield		84	4	2013
	Two new publications from BHQ: Baptists in Qld; National Guide			84	4	2013
	Memorial Display Cabinets for Archives			84	4	2013
	Milestone for the Archives: and others			83	12	2012
	Baptist Church Archives Qld Turns 30			83	12	2012
	Tracing our First Minister's Family			83	12	2012
	BHQ Annual Report 2012			83	12	2012
	Something more than Gold Launching			82	8	2012
	By-Laws, Anniversaries & Celebrations			82	8	2012
	Digitisation of Church Records: a Guide			82	8	2012
	Fascinating Figures: Baptists and the 2011 Census	David Parker		82	8	2012
	Baptists on the Darling Downs			82	8	2012
	Senior Girls’ Missionary Union: Bill Hughes			82	8	2012
	An Appeal to Church Historians: BWA	Neville Callam		82	8	2012
	Something more than Gold: Ready for Launching			81	4	2012
	Archives: Going Digital			81	4	2012
	Warwick Centenary Celebrations	Bill Hughes		81	4	2012
	Saved: the Gatton Story			81	4	2012
	Jireh Honour Board Stars			81	4	2012
